,0,1,2,3,4,5,6,7,8,9,10,11,12,13,14,15,16,17,18,19,20,21,22,23,24,25,26,27,28,29,30,31,32,33,34,35,36,37,38,39,40,41,42,43,44,45,46,47,48,49,50,51,52,53,54,55,56,57,58,59,60,61,62,63,64,65,66,67,68,69,70,71,72,73,74,75,76,77,78,79,80
0,acadia20_426,,,,,,,,,,,,,,,,,,,,,,,,,,,,,,,,,,,,,,,,,,,,,,,,,,,,,,,,,,,,,,,,,,,,,,,,,,,,,,,,
1,"Zohier, Islam; EL Antably, Ahmed; S. Madani, Ahmed",,,,,,,,,,,,,,,,,,,,,,,,,,,,,,,,,,,,,,,,,,,,,,,,,,,,,,,,,,,,,,,,,,,,,,,,,,,,,,,,
2,2020,,,,,,,,,,,,,,,,,,,,,,,,,,,,,,,,,,,,,,,,,,,,,,,,,,,,,,,,,,,,,,,,,,,,,,,,,,,,,,,,
3,An AI Lens on Historic Cairo,,,,,,,,,,,,,,,,,,,,,,,,,,,,,,,,,,,,,,,,,,,,,,,,,,,,,,,,,,,,,,,,,,,,,,,,,,,,,,,,
4,"ACADIA 2020: Distributed Proximities / Volume I: Technical Papers [Proceedings of the 40th Annual Conference of the Association of Computer Aided Design in Architecture (ACADIA) ISBN 978-0-578-95213-0]. Online and Global. 24-30 October 2020. edited by B. Slocum, V. Ago, S. Doyle, A. Marcus, M. Yablonina, and M. del Campo. 426-434.",,,,,,,,,,,,,,,,,,,,,,,,,,,,,,,,,,,,,,,,,,,,,,,,,,,,,,,,,,,,,,,,,,,,,,,,,,,,,,,,
5,"Reports show that numerous heritage sites are in danger due to conflicts and heritage mismanagement in many parts of the world. Experts have resorted to digital tools to attempt to conserve and preserve endangered and damaged sites. To that end, in this applied research, we aim to develop a deep learning framework applied to the decaying tangible heritage of Historic Cairo, known as The City of a Thousand Minarets. The proposed framework targets Cairos historic minaret styles as a test case study for the broader applications of deep learning in digital heritage. It comprises recognition and segmentation tasks, which use a deep learning semantic segmentation model trained on two data sets representing the two most dominant minaret styles in the city, Mamluk (12501517 CE) and Ottoman (15171952 CE). The proposed framework aims to classify these two types using images. It can help create a multidimensional model from just a photograph of a historic building, which can quickly catalog and document a historic building or element. The study also sheds light on the obstacles preventing the exploration and implementation of deep learning techniques in digital heritage. The research presented in this paper is a work-in-progress of a larger applied research concerned with implementing deep learning techniques in the digital heritage domain.",,,,,,,,,,,,,,,,,,,,,,,,,,,,,,,,,,,,,,,,,,,,,,,,,,,,,,,,,,,,,,,,,,,,,,,,,,,,,,,,
6,ACADIA,,,,,,,,,,,,,,,,,,,,,,,,,,,,,,,,,,,,,,,,,,,,,,,,,,,,,,,,,,,,,,,,,,,,,,,,,,,,,,,,
7,paper,,,,,,,,,,,,,,,,,,,,,,,,,,,,,,,,,,,,,,,,,,,,,,,,,,,,,,,,,,,,,,,,,,,,,,,,,,,,,,,,
8,islam.zohier@student.aast.edu,,,,,,,,,,,,,,,,,,,,,,,,,,,,,,,,,,,,,,,,,,,,,,,,,,,,,,,,,,,,,,,,,,,,,,,,,,,,,,,,
9,"file.pdf (4,863,984 bytes)",,,,,,,,,,,,,,,,,,,,,,,,,,,,,,,,,,,,,,,,,,,,,,,,,,,,,,,,,,,,,,,,,,,,,,,,,,,,,,,,
10,"Content-type: text/plain




Details
Citation
Select





Alom, Md Zahangir, Chris Yakopcic, Mahmudul Hasan, Tarek Taha, and Vijayan Asari (2019) 
 Recurrent Residual U-Net for Medical Image Segmentation
, Journal of Medical Imaging 6 (1): 014006. https://doi.org/10.1117/1.JMI.6.1.014006







Behrens-Abouseif, Doris, Bernard OKane, and Nicolas Werner (2010) 
 The Minarets of Cairo
, Cairo, Egypt: American University in Cairo Press







Deng, J., Wei Dong, R. Socher, Li-Jia Li, Kai Li, and Li Fei-Fei (2009) 
 ImageNet: A Large-Scale Hierarchical Image Database
, 2009 IEEE Conference on Computer Vision and Pattern Recognition: 248255. https://doi.org/10.1109/CVPR.2009.5206848







El Habashi, Alaa (2008) 
 Monuments or Functioning Buildings: Legal Protection over Five Case-Study Historic Hammams in the Mediterranean
, ArchNet-IJAR: International Journal of Architectural Research 2 (3): 4255. https://www.archnet.org/publications/5171







El-Dardiry, Aliaa, and Ahmed El Antably (2020) 
 Farewell al-An-bariyin
, International Journal of Environmental Science & Sustainable Development 5 (1): 113. https://doi.org/10.21625/essd.v5i1.713







Grilli, Eleonora, and Fabio Remondino (2019) 
 Classification of 3D Digital Heritage
, Remote Sensing 11 (7): 847. https://doi.org/10.3390/rs11070847







He, Kaiming, Xiangyu Zhang, Shaoqing Ren, and Jian Sun (2016) 
 Deep Residual Learning for Image Recognition
, Proceedings of the IEEE Conference on Computer Vision and Pattern Recognition: 770778. https://doi.org/10.1109/CVPR.2016.90







Hermoza, Renato, and Ivan Sipiran (2018) 
 3D Reconstruction of Incomplete Archaeological Objects Using a Generative Adversarial Network
, Proceedings of Computer Graphics International 2018. Bintan Island, Indonesia. https://doi.org/10.1145/3208159.3208173







Iglovikov, Vladimir, and Alexey Shvets (2018) 
 Ternausnet: U-Net with VGG11 encoder pre-trained on ImageNet for image segmentation
, arXiv preprint. arXiv:1801.05746







Joshi, Ameet V (2020) 
 Amazons Machine Learning Toolkit: Sagemaker
, Machine Learning and Artificial Intelligence, 233243. Cham: Springer International Publishing







Kaplan, Frédéric (2015) 
 The Venice Time Machine
, Proceedings of the 2015 ACM Symposium on Document Engineering: 73. https://doi.org/10.1145/2682571.2797071







Kaplan, Frédéric (2020) 
 Big Data of the Past, from Venice to Europe
, Proceedings of the Twenty-Fifth International Conference on Architectural Support for Programming Languages and Operating Systems: 1. https://doi.org/10.1145/3373376.3380611







Kniaz, V. V., Fabio Remondino, and V. A. Knyaz (2019) 
 Generative Adversarial Networks for Single Photo 3D Reconstruction
, ISPRSInternational Archives of the Photogrammetry, Remote Sensing and Spatial Information Sciences 42W9: 403. https://doi.org/10.5194/isprs-archives-XLII-2-W9-403-2019







LeCun, Yann, Yoshua Bengio, and Geoffrey Hinton (2015) 
 Deep Learning
, Nature 521 (7553): 436444. https://doi.org/10.1038/nature14539







Levin, Noam, Saleem Ali, David Crandall, and Salit Kark (2019) 
 World Heritage in Danger: Big Data and Remote Sensing can Help Protect Sites in Conflict Zones
, Global Environmental Change 55: 97104. https://doi.org/https://doi.org/10.1016/j.gloenvcha.2019.02.001







Li, Mengtian, Yu-Xiong Wang, and Deva Ramanan (2020) 
 Towards Streaming Perception
, Lecture Notes in Computer Science 12347: 47388. https://doi.org/10.1007/978-3-030-58536-5_28







Lin, Tsung-Yi, Michael Maire, Serge Belongie, James Hays, Pietro Perona, Deva Ramanan, Piotr Dollár, and C. Lawrence Zitnick (2014) 
 Microsoft COCO: Common Objects in Context
, Computer Vision  ECCV 2014. ECCV 2014. Lecture Notes in Computer Science, edited by D. Fleet, T. Pajdla, B. Schiele, and T. Tuytelaars, 740755. https://doi.org/10.1007/978-3-319-10602-1_48







Llamas, Jose, Pedro M. Lerones, Roberto Medina, Eduardo Zalama, and Jaime Gómez-García-Bermejo (2017) 
 Classification of Architectural Heritage Images Using Deep Learning Techniques
, Applied Sciences 7 (10): 992. https://doi.org/doi:10.3390/app7100992







Pan, Jiao, Liang Li, Hiroshi Yamaguchi, Kyoko Hasegawa, Fadjar I Thufail, Bra Mantara, and Satoshi Tanaka (2018) 
 3D Reconstruction and Transparent Visualization of Indonesian Cultural Heritage from a Single Image
, Eurographics Workshop on Graphics and Cultural Heritage. https://doi.org/10.2312/gch.20181363







Roh, Yuji, Geon Heo, and Steven Euijong Whang (2019) 
 A Survey on Data Collection for Machine Learning: A Big DataAI Integration Perspective
, IEEE Transactions on Knowledge and Data Engineering: 11. https://doi.org/10.1109/TKDE.2019.2946162",,"Alom, Md Zahangir, Chris Yakopcic, Mahmudul Hasan, Tarek Taha, and Vijayan Asari (2019) 
 Recurrent Residual U-Net for Medical Image Segmentation
, Journal of Medical Imaging 6 (1): 014006. https://doi.org/10.1117/1.JMI.6.1.014006",,,,"Behrens-Abouseif, Doris, Bernard OKane, and Nicolas Werner (2010) 
 The Minarets of Cairo
, Cairo, Egypt: American University in Cairo Press",,,,"Deng, J., Wei Dong, R. Socher, Li-Jia Li, Kai Li, and Li Fei-Fei (2009) 
 ImageNet: A Large-Scale Hierarchical Image Database
, 2009 IEEE Conference on Computer Vision and Pattern Recognition: 248255. https://doi.org/10.1109/CVPR.2009.5206848",,,,"El Habashi, Alaa (2008) 
 Monuments or Functioning Buildings: Legal Protection over Five Case-Study Historic Hammams in the Mediterranean
, ArchNet-IJAR: International Journal of Architectural Research 2 (3): 4255. https://www.archnet.org/publications/5171",,,,"El-Dardiry, Aliaa, and Ahmed El Antably (2020) 
 Farewell al-An-bariyin
, International Journal of Environmental Science & Sustainable Development 5 (1): 113. https://doi.org/10.21625/essd.v5i1.713",,,,"Grilli, Eleonora, and Fabio Remondino (2019) 
 Classification of 3D Digital Heritage
, Remote Sensing 11 (7): 847. https://doi.org/10.3390/rs11070847",,,,"He, Kaiming, Xiangyu Zhang, Shaoqing Ren, and Jian Sun (2016) 
 Deep Residual Learning for Image Recognition
, Proceedings of the IEEE Conference on Computer Vision and Pattern Recognition: 770778. https://doi.org/10.1109/CVPR.2016.90",,,,"Hermoza, Renato, and Ivan Sipiran (2018) 
 3D Reconstruction of Incomplete Archaeological Objects Using a Generative Adversarial Network
, Proceedings of Computer Graphics International 2018. Bintan Island, Indonesia. https://doi.org/10.1145/3208159.3208173",,,,"Iglovikov, Vladimir, and Alexey Shvets (2018) 
 Ternausnet: U-Net with VGG11 encoder pre-trained on ImageNet for image segmentation
, arXiv preprint. arXiv:1801.05746",,,,"Joshi, Ameet V (2020) 
 Amazons Machine Learning Toolkit: Sagemaker
, Machine Learning and Artificial Intelligence, 233243. Cham: Springer International Publishing",,,,"Kaplan, Frédéric (2015) 
 The Venice Time Machine
, Proceedings of the 2015 ACM Symposium on Document Engineering: 73. https://doi.org/10.1145/2682571.2797071",,,,"Kaplan, Frédéric (2020) 
 Big Data of the Past, from Venice to Europe
, Proceedings of the Twenty-Fifth International Conference on Architectural Support for Programming Languages and Operating Systems: 1. https://doi.org/10.1145/3373376.3380611",,,,"Kniaz, V. V., Fabio Remondino, and V. A. Knyaz (2019) 
 Generative Adversarial Networks for Single Photo 3D Reconstruction
, ISPRSInternational Archives of the Photogrammetry, Remote Sensing and Spatial Information Sciences 42W9: 403. https://doi.org/10.5194/isprs-archives-XLII-2-W9-403-2019",,,,"LeCun, Yann, Yoshua Bengio, and Geoffrey Hinton (2015) 
 Deep Learning
, Nature 521 (7553): 436444. https://doi.org/10.1038/nature14539",,,,"Levin, Noam, Saleem Ali, David Crandall, and Salit Kark (2019) 
 World Heritage in Danger: Big Data and Remote Sensing can Help Protect Sites in Conflict Zones
, Global Environmental Change 55: 97104. https://doi.org/https://doi.org/10.1016/j.gloenvcha.2019.02.001",,,,"Li, Mengtian, Yu-Xiong Wang, and Deva Ramanan (2020) 
 Towards Streaming Perception
, Lecture Notes in Computer Science 12347: 47388. https://doi.org/10.1007/978-3-030-58536-5_28",,,,"Lin, Tsung-Yi, Michael Maire, Serge Belongie, James Hays, Pietro Perona, Deva Ramanan, Piotr Dollár, and C. Lawrence Zitnick (2014) 
 Microsoft COCO: Common Objects in Context
, Computer Vision  ECCV 2014. ECCV 2014. Lecture Notes in Computer Science, edited by D. Fleet, T. Pajdla, B. Schiele, and T. Tuytelaars, 740755. https://doi.org/10.1007/978-3-319-10602-1_48",,,,"Llamas, Jose, Pedro M. Lerones, Roberto Medina, Eduardo Zalama, and Jaime Gómez-García-Bermejo (2017) 
 Classification of Architectural Heritage Images Using Deep Learning Techniques
, Applied Sciences 7 (10): 992. https://doi.org/doi:10.3390/app7100992",,,,"Pan, Jiao, Liang Li, Hiroshi Yamaguchi, Kyoko Hasegawa, Fadjar I Thufail, Bra Mantara, and Satoshi Tanaka (2018) 
 3D Reconstruction and Transparent Visualization of Indonesian Cultural Heritage from a Single Image
, Eurographics Workshop on Graphics and Cultural Heritage. https://doi.org/10.2312/gch.20181363",,,,"Roh, Yuji, Geon Heo, and Steven Euijong Whang (2019) 
 A Survey on Data Collection for Machine Learning: A Big DataAI Integration Perspective
, IEEE Transactions on Knowledge and Data Engineering: 11. https://doi.org/10.1109/TKDE.2019.2946162",,
11,2021/10/28 06:57,,,,,,,,,,,,,,,,,,,,,,,,,,,,,,,,,,,,,,,,,,,,,,,,,,,,,,,,,,,,,,,,,,,,,,,,,,,,,,,,
